### ISSUE TITLE
Error on ossec-logs

### ISSUE THREAD

**Issue by mziadh** [ossec/ossec-hids#972]
Hello,

I just deployed ossec-hids version 2.8.3 on a windows server 2012
My ossec server is CentOS 6.7

I post the logs related to my agent:

2016/10/14 08:05:37 ossec-agent: INFO: Service does not exist (OssecSvc) nothing to remove.
2016/10/14 08:05:37 ossec-agent: INFO: Successfully added to the service database.
2016/10/14 08:05:37 setup-windows: INFO: System is Vista or newer (Microsoft Windows Server 2012 Standard Edition  (Build 9200) - OSSEC HIDS v2.8.3).
2016/10/14 08:07:17 manage-agents: INFO: Running the following command (C:\Windows\system32\cmd.exe /c echo y|cacls "client.keys" /T /G Administrators:f)
2016/10/14 08:07:38 ossec-win32ui: INFO: Running the following command (C:\Windows\system32\cmd.exe /c echo y|cacls "new-ossec.conf" /T /G Administrators:f)
2016/10/14 08:07:42 ossec-agent: Using notify time: 600 and max time to reconnect: 1800
2016/10/14 08:07:42 ossec-execd(1350): INFO: Active response disabled. Exiting.
2016/10/14 08:07:42 ossec-agent(1410): INFO: Reading authentication keys file.
2016/10/14 08:07:42 ossec-agent: INFO: Trying to connect to server (10.21.48.5:1514).
2016/10/14 08:07:42 ossec-agent: INFO: Using IPv4 for: 10.21.48.5 .
2016/10/14 08:07:42 ossec-agent: Starting syscheckd thread.
2016/10/14 08:07:42 ossec-rootcheck: INFO: Started (pid: 37512).
2016/10/14 08:07:42 ossec-agent: INFO: Monitoring registry entry: 'HKEY_LOCAL_MACHINE\Software\Classes\batfile'.
.
.
.
2016/10/14 08:07:42 ossec-agent: INFO: Monitoring directory: 'C:\Documents and Settings/All Users/Start Menu/Programs/Startup'.
2016/10/14 08:07:42 ossec-agent: INFO: Monitoring directory: 'C:\Users/Public/All Users/Microsoft/Windows/Start Menu/Startup'.
2016/10/14 08:07:42 ossec-agent: INFO: Started (pid: 37512).
**2016/10/14 08:07:52 ossec-agent: WARN: Process locked. Waiting for permission...**
2016/10/14 08:08:03 ossec-agent(4101): WARN: Waiting for server reply (not started). Tried: '10.21.48.5'.
2016/10/14 08:08:05 ossec-agent: INFO: Trying to connect to server (10.21.48.5:1514).

I check network connection from my windows client to my server using portquery:

 Starting portqry.exe -n 10.21.48.5 -e 1514 -p UDP ...
Querying target system called:
 10.21.48.5
Attempting to resolve IP address to a name...
Failed to resolve IP address to name
querying...
UDP port 1514 (unknown service): LISTENING or FILTERED
portqry.exe -n 10.21.48.5 -e 1514 -p UDP exits with return code 0x00000002.

On my server:
I used tcpdump to monitor the traffic, which seems passing fine:

/var/ossec/queue/agent-info]# 05:50:22.459017 IP 10.21.50.10.59331 > 10.21.48.5.fujitsu-dtcns: Flags [SEW], seq 571022093, win 8192, options [mss 1460,nop,wscale 8,nop,nop,sackOK], length 0
05:50:22.459032 IP 10.21.48.5.fujitsu-dtcns > 10.21.50.10.59331: Flags [R.], seq 0, ack 571022094, win 0, length 0
05:50:22.956150 IP 10.21.50.10.59331 > 10.21.48.5.fujitsu-dtcns: Flags [S], seq 571022093, win 8192, options [mss 1460,nop,wscale 8,nop,nop,sackOK], length 0
05:50:22.956169 IP 10.21.48.5.fujitsu-dtcns > 10.21.50.10.59331: Flags [R.], seq 0, ack 1, win 0, length 0
05:50:23.471674 IP 10.21.50.10.59331 > 10.21.48.5.fujitsu-dtcns: Flags [S], seq 571022093, win 8192, options [mss 1460,nop,nop,sackOK], length 0
05:50:23.471683 IP 10.21.48.5.fujitsu-dtcns > 10.21.50.10.59331: Flags [R.], seq 0, ack 1, win 0, length 0

When i pass the command on my server: /var/ossec/bin/agent_control -l 
i see:
OSSEC HIDS agent_control. List of available agents:
 ID: 011, Name: BNET-FRONT-01, IP: 10.21.50.10/32, **Never connected**

Other client agents are working fine and being active.

I changed the network address to 10.21.50.10 and the issue remains the same.

Could you please help me troubleshooting the issue with Process locked. Waiting for permission..?

Thanks in advance.

Kind regards,
Ziad

**Comment by marcRBD** [comment]
hi 
and the ossec.log of the server ? 

do you have an old agent with the same ip address ?
(you have to remove it)
i have the case one time.
thanks

**Comment by mziadh** [comment]
Hello Marc,

Thanks for the fast reply.

Here’s part of ossec.log file on the server:

tail -100 /var/ossec/logs/ossec.log
2016/10/14 06:08:34 ossec-analysisd: INFO: Chrooted to directory: /var/ossec, using user: ossec
2016/10/14 06:08:34 ossec-analysisd: INFO: Started (pid: 17205).
2016/10/14 06:08:34 ossec-analysisd: SyscheckInit completed.
2016/10/14 06:08:34 ossec-analysisd: RootcheckInit completed.
2016/10/14 06:08:34 ossec-analysisd: OS_CreateEventList completed.
2016/10/14 06:08:34 ossec-analysisd: DEBUG: FTSInit completed.
2016/10/14 06:08:34 ossec-analysisd: DEBUG: Active response Init completed.
2016/10/14 06:08:34 ossec-analysisd: DEBUG: Startup completed. Waiting for new messages..
2016/10/14 06:08:35 ossec-syscheckd: INFO: (unix_domain) Maximum send buffer set to: '200000'.
2016/10/14 06:08:35 ossec-monitord: DEBUG: Starting ...
2016/10/14 06:08:35 ossec-monitord: INFO: Chrooted to directory: /var/ossec, using user: ossec
2016/10/14 06:08:35 ossec-monitord: INFO: Started (pid: 17226).
2016/10/14 06:08:35 ossec-remoted: INFO: (unix_domain) Maximum send buffer set to: '200000'.
2016/10/14 06:08:35 ossec-remoted(4111): INFO: Maximum number of agents allowed: '256'.
2016/10/14 06:08:35 ossec-remoted(1410): INFO: Reading authentication keys file.
2016/10/14 06:08:35 ossec-remoted: DEBUG: OS_StartCounter.
2016/10/14 06:08:35 ossec-remoted: OS_StartCounter: keysize: 6
2016/10/14 06:08:35 ossec-remoted: INFO: No previous counter available for 'BNET-BDD-01'.
2016/10/14 06:08:35 ossec-remoted: INFO: Assigning counter for agent BNET-BDD-01: '0:0'.
2016/10/14 06:08:35 ossec-remoted: INFO: Assigning counter for agent BNET-RBD-WIN-01: '158234:5486'.
2016/10/14 06:08:35 ossec-remoted: INFO: Assigning counter for agent BNET-AD-WIN-01: '158362:3898'.
2016/10/14 06:08:35 ossec-remoted: INFO: Assigning counter for agent BNET-WSUS-01: '193587:1291'.
2016/10/14 06:08:35 ossec-remoted: INFO: Assigning counter for agent BNET-AV-WIN-01: '188395:901'.
2016/10/14 06:08:35 ossec-remoted: INFO: No previous counter available for 'BNET-FRONT-01'.
2016/10/14 06:08:35 ossec-remoted: INFO: Assigning counter for agent BNET-FRONT-01: '0:0'.
2016/10/14 06:08:35 ossec-remoted: INFO: Assigning sender counter: 1:2394
2016/10/14 06:08:35 ossec-remoted: DEBUG: OS_StartCounter completed.

The old agent was already removed:

cat /var/ossec/etc/client.keys
001 BNET-BDD-01 10.21.49.10 588fe94d0a7adfe35f5c2b134e093cae95f67ae1e06470b5bfb227dab61a1404
003 BNET-RBD-WIN-01 10.21.48.4 e6ddc39e143f037e4b6ff69006de77109122ab7747160704cb82c1725ce10247
004 BNET-AD-WIN-01 10.21.48.6 2b4934786ec2621fbad17c34498acc4a716ea07699a72d12c16694c8c36c2ddf
005 BNET-WSUS-01 10.21.48.8 5ea80d39c4ba0959be4c4a43ec5ad38640f0683977bd631319df1104ea84696e
006 #*#*#*#*#*#*#*#*#*#*#48.5 40caa19ecac6d7dc71dca30696b679141cab01a0024fcc49ce87fb9a2a348025
007 #*#*#*#*#*#*#*#*#*#*#11 5744f6784d65ff21e775dd9b5ae88b68b33cfdd34888567d3c48b0793eb7395d
008 #*#*#*#*#*#*#*#*#*#*#1 9c4cadffd5154a33ee06a53f7a1cd80691df2ec24f39f3bd48881236e02b423c
009 BNET-AV-WIN-01 10.21.48.9 a1630dae8be44bdcd81c326e799b8cdb8d7b2ccf40af0de8cdfd92e38fa1a33b
011 BNET-FRONT-01 10.21.50.10/32 b662343ae643405a3433b711cbe8027a8256d5585272738c836457061dc4b1d9

Formally the ID 010 was being used for BNET-FRONT-01.

I think there might be an issue:
The affected client (BNET-FRONT-01) and the ossec server are on different VLAN
The other working clients BNET-RBD-WIN-01, BNET-AD-WIN-01 and BNET-WSUS-01 are in the same subnet as the osscec server (10.21.48.5)

Regards,

Ziad Hosany
Administrateur Sécurité

LINKBYNET INDIAN OCEAN (L.I.O) LIMITED
8th Floor, Orbis Court
132 St Jean (A8)
Quatre Bornes, 72218
Maurice
Tel: (+230) 467 5247 / (+33) 1 48132245
Fax: 466 6637
Email : z.hosany@linkbynet.com<mailto:z.hosany@linkbynet.com>

Business Registration Number : C07049433

De : marcRBD [mailto:notifications@github.com]
Envoyé : 14 October 2016 13:52
À : ossec/ossec-hids <ossec-hids@noreply.github.com>
Cc : Ziad HOSANY <z.hosany@linkbynet.com>; Author <author@noreply.github.com>
Objet : Re: [ossec/ossec-hids] Error on ossec-logs (#972)


hi
and the ossec.log of the server ?

do you have an old agent with the same ip address ?
(you have to remove it)
i have the case one time.
thanks

**Comment by mziadh** [comment]
Hello,

My problem is solved, it was vlan issue. Port 1514 was opened in tcp mode. We corrected it to UDP and the issue is resolved. Thanks for the kind exchanges guys.
Keep up the good work .
With due respect,
Ziad

**Comment by indradanielb** [comment]
> Hello,
> 
> My problem is solved, it was vlan issue. Port 1514 was opened in tcp mode. We corrected it to UDP and the issue is resolved. Thanks for the kind exchanges guys.
> Keep up the good work .
> With due respect,
> Ziad

how do you change it from tcp to udp?
i has the same problem
thanks
